{
  "schema": "autopilot.decision/1",
  "question": "請選 A 還是 B？",
  "options": [
    "A",
    "B"
  ],
  "context": null,
  "not_authorized": null,
  "root_run_id": "job-1791513684-0efcd31c",
  "repo_identity": "git-common-dir:/home/cookys/projects/gate-sandbox/.git",
  "project_key": "51de403da82a23f0",
  "opened_at": "2026-10-09T02:43:10.679Z",
  "opened_by_session": "aae85c79-d1b4-4577-a393-8f1af8f4507b",
  "source": "ask_user_question"
}
